name,description_text,image_url,type,rarity,transmission,incubation_period,stages,symptoms,mechanical_effects,duration,mortality_rate,sequelae,natural_remedies,magical_remedies,alchemical_remedies,prevention,immunity_after_recovery,immunity_duration,affected_species,origin,historical_outbreaks,cultural_impact,warnings,notes,id,created_date,updated_date,created_by_id,created_by,is_sample
Pourriture Verte,Infection fongique qui transforme progressivement la chair en masse verdâtre spongieuse. Commence par les extrémités et progresse vers le tronc.,,Fongique,Rare,,2d4 jours,,"Taches vertes qui s'étendent, chair devient spongieuse et pourrie, odeur infecte de moisi, perte progressive de tissus, douleurs",Progression dévastatrice. Sans traitement urgent au stade 3: amputation nécessaire ou mort,7-14 jours jusqu'à la mort sans traitement,"80% sans traitement, 30% avec traitement (souvent avec amputation)",,,,,"Éviter l'eau stagnante des cavernes, porter des bottes imperméables, nettoyer immédiatement toute blessure avec de l'alcool fort",FALSE,,,"Découverte dans les grottes humides de la Forêt Noire, semble avoir été créée par un druide fou",Épidémie de 1289 dans le village minier de Grisombre - 40% de morts,Les mineurs portent désormais des amulettes anti-fongiques et se lavent au vinaigre quotidiennement,AMPUTATION IMMÉDIATE recommandée si stade 3 atteint et aucun clerc disponible. Ne pas hésiter.,,68e2a18782c6852cf033241f,2025-10-05T16:49:11.263000,2025-10-05T16:49:11.263000,68d133369c4bfb4942ca73e3,greg.demeulenaere@gmail.com,FALSE
Corruption Arcanique,"Maladie magique affectant uniquement les lanceurs de sorts. L'énergie magique dans le corps devient instable et corrompue, causant des effets imprévisibles.",,Magique,Rare,,1d4 jours après surcharge magique ou contact avec magie corrompue,,"Aura magique instable visible, yeux brillants, étincelles spontanées, maux de tête sévères, saignements lors d'incantations, convulsions d'énergie",Affecte uniquement les lanceurs de sorts. Rend la magie dangereuse et imprévisible,"2-3 semaines sans traitement, peut devenir permanent",40% (souvent par explosion magique au stade 3),,,,,"Éviter la surcharge magique (lancer trop de sorts trop rapidement), éviter les zones de magie sauvage, ne pas toucher d'artefacts corrompus sans protection",FALSE,,,"Apparue après la Grande Rupture Magique de 1156, causée par l'explosion d'une Tour de Magie",Affecte environ 50 mages par an dans l'Académie Arcanique,Les mages sont désormais formés à reconnaître les signes et à pratiquer la 'magie sûre',ARRÊTER IMMÉDIATEMENT de lancer des sorts dès les premiers symptômes. Pourrait devenir un Élémentaire Sauvage incontrôlé au stade 3.,,68e2a18782c6852cf0332420,2025-10-05T16:49:11.263000,2025-10-05T16:49:11.263000,68d133369c4bfb4942ca73e3,greg.demeulenaere@gmail.com,FALSE
Malédiction du Loup-Garou,Maladie maudite transmise par la morsure d'un lycanthrope. Transforme progressivement la victime en loup-garou lors des pleines lunes.,,Maudite,Rare,,Jusqu'à la prochaine pleine lune (1-30 jours),,"Entre les transformations: agitation avant la pleine lune, sens aiguisés, agressivité croissante, pilosité accrue, yeux dorés. Pendant la transformation: douleur extrême, perte de conscience humaine, comportement de prédateur",Transformation involontaire à chaque pleine lune. Forme de loup-garou avec statistiques de lycanthrope mais aucun contrôle,Permanent sans traitement,"0% directement, mais risque élevé de tuer d'autres personnes pendant les transformations",,,,,"Éviter les loups-garous, porter de l'argent (brûle leur peau), rester enfermé les nuits de pleine lune si dans une zone à risque",TRUE,Permanente si guéri avant 1 an,,Malédiction ancestrale remontant au Pacte Noir avec les Esprits de la Chasse,Meutes de loups-garous ont terrorisé la Forêt Sombre pendant des siècles,"Les villageois s'enferment lors des pleines lunes, chasseurs de monstres spécialisés formés, commerce d'argent florissant",QUARANTAINE IMMÉDIATE lors des pleines lunes. Les victimes transformées sont EXTRÊMEMENT dangereuses. Seul l'argent ou la magie peut les blesser.,,68e2a18782c6852cf0332421,2025-10-05T16:49:11.263000,2025-10-05T16:49:11.263000,68d133369c4bfb4942ca73e3,greg.demeulenaere@gmail.com,FALSE
Grippe Commune,"Maladie virale très contagieuse mais généralement bénigne. Se propage rapidement dans les villes, surtout en hiver.",,Virale,Commun,,1d3 jours,,"Fièvre modérée, toux, mal de gorge, nez qui coule, fatigue, courbatures, frissons",Désavantage aux jets de Constitution et de Force pendant 1d4+3 jours. Fatigue générale.,3-7 jours,1% (surtout enfants et personnes âgées),,,,,"Se laver les mains régulièrement, éviter les foules pendant les épidémies, porter un masque",TRUE,6 mois à 1 an (le virus mute),,Existe depuis la nuit des temps,Épidémies hivernales annuelles dans toutes les grandes villes,Considérée comme un mal nécessaire de l'hiver. Les marchés vendent des remèdes à chaque coin de rue.,,,68e2a18782c6852cf0332422,2025-10-05T16:49:11.263000,2025-10-05T16:49:11.263000,68d133369c4bfb4942ca73e3,greg.demeulenaere@gmail.com,FALSE
Mort Rouge,"Fléau épidémique dévastateur. Hémorragies internes et externes massives, progression fulgurante, mortalité extrême. La pire maladie connue.",,Virale,Épidémique,,6-12 heures,,"Fièvre foudroyante, maux de tête insupportables, puis saignements par tous les orifices (yeux, nez, oreilles, bouche, peau), vomissements de sang noir, convulsions, coma",Progression ultra-rapide. Mort en 24-48 heures sans traitement magique puissant,24-48 heures jusqu'à la mort,"95% sans magie puissante, 60% avec traitement magique optimal",,,,,QUARANTAINE TOTALE immédiate de toute zone affectée. Port de combinaisons intégrales. Incinération des corps. Fermeture des frontières,TRUE,Permanente,,Inconnue. Première apparition en 987. Certains pensent qu'elle vient des Plans Inférieurs,Grande Mort de 1156: 40% de la population du royaume éradiquée en 3 mois. Épidémie de 1398: ville entière de Bravoure rasée et brûlée pour stopper la propagation,Terreur absolue. Des villes entières ont été abandonnées. Protocoles de quarantaine draconiens établis. Les survivants sont marqués à vie,NIVEAU DE MENACE MAXIMUM. QUARANTAINE OBLIGATOIRE. PORT D'ÉQUIPEMENT DE PROTECTION INTÉGRAL. NE PAS TOUCHER LES CORPS. INCINÉRATION IMMÉDIATE. ALERTE L'ACADÉMIE ARCANIQUE ET LE ROI IMMÉDIATEMENT.,,68e2a18782c6852cf0332423,2025-10-05T16:49:11.263000,2025-10-05T16:49:11.263000,68d133369c4bfb4942ca73e3,greg.demeulenaere@gmail.com,FALSE
Touche Spectrale,Maladie psychique causée par l'exposition prolongée aux morts-vivants ou aux énergies nécromantiques. L'esprit commence à 'mourir' avant le corps.,,Psychique,Peu commune,,1d6 jours,,"Obsession de la mort, cauchemars constants, perte progressive des émotions, teint pâle cadavérique, yeux vitreux, commence à ressembler à un mort-vivant",Affecte principalement l'esprit. Peut transformer la victime en mort-vivant à sa mort si stade 3 atteint,2-4 semaines sans traitement,"30% (beaucoup se suicident), 50% deviennent des morts-vivants à leur mort",,,,,"Limiter l'exposition aux morts-vivants et à la nécromancie, porter des talismans de protection psychique, pratiques spirituelles régulières",FALSE,,,Apparue dans les cryptes maudites après la Grande Guerre Nécromantique,"Affecte souvent les nécromanciens, fossoyeurs, et aventuriers explorant des tombeaux",Les prêtres offrent des bénédictions gratuites aux fossoyeurs. Les nécromanciens sont vus avec méfiance,Éviter absolument si déjà dépressif. Le risque de suicide au stade 3 est élevé. Surveillance constante recommandée.,,68e2a18782c6852cf0332424,2025-10-05T16:49:11.263000,2025-10-05T16:49:11.263000,68d133369c4bfb4942ca73e3,greg.demeulenaere@gmail.com,FALSE
Rouille Draconique,Maladie rare qui transforme lentement les écailles ou la peau en métal rouillé. Contractée près des repaires de dragons de métal corrompus.,,Alchimique,Très rare,,1d4 semaines,,"Peau devient métallique et dure, zones rouillées apparaissent, craquements lors des mouvements, douleurs articulaires intenses, perte de flexibilité",Augmente l'armure mais réduit drastiquement la mobilité. Peut mener à la paralysie totale,6 mois à 1 an jusqu'à paralysie complète,15% (meurent de suffocation quand le torse se fige),,,,,"Éviter l'eau près des repaires de dragons métalliques anciens, porter des gants, purifier l'eau avant de boire",TRUE,Permanente,,Découverte près des Montagnes de Cuivre où un dragon de cuivre ancien est mort il y a des siècles,,,Ne pas confondre avec une transmutation magique volontaire. C'est une maladie grave.,,68e2a18782c6852cf0332425,2025-10-05T16:49:11.263000,2025-10-05T16:49:11.263000,68d133369c4bfb4942ca73e3,greg.demeulenaere@gmail.com,FALSE